{
  "api_version": "tekmovela.io/v1alpha1",
  "kind": "AccountabilityRecord",
  "id": "aar.checkout.double_spend",
  "run_ref": "run.evidence_20260815",
  "trace_envelope_ref": "trace.checkout.1",
  "attribution_ref": "attribution.checkout.1",
  "explanation_ref": "explanation.checkout.1",
  "authorization_ref": "authorization.checkout.1",
  "recorded_at": "2026-08-15T10:00:00Z",
  "digest": "sha256:aaaaaaaaaaaaaaaaaaaaaaaaaaaaaaaaaaaaaaaaaaaaaaaaaaaaaaaaaaaaaaaa"
}
